{
  "$schema": "https://json-schema.org/draft/2020-12/schema",
  "$id": "https://rec.app/spec/notes.schema.json",
  "title": "rec notes",
  "description": "{base}.notes.v1.json beside the recording's parts. Final notes — after every change to them: a pass, an edit, a deletion — also go to the recording's Drive or iCloud folder as {base}.notes.json, the same JSON, with the folder's notesAt; a local folder keeps them on the device. See docs/recly.md §8 \"Organizing\" and §3 \"Drive layout\".",
  "type": "object",
  "additionalProperties": false,
  "required": [
    "schema",
    "recordingId",
    "stage",
    "items",
    "tombstones",
    "conversations",
    "parts",
    "createdAt",
    "updatedAt"
  ],
  "properties": {
    "schema": {
      "const": 1
    },
    "recordingId": {
      "$ref": "#/$defs/ulid"
    },
    "stage": {
      "description": "provisional: made while recording, part by part; final: made after Stop from the recording's transcript.",
      "enum": [
        "provisional",
        "final"
      ]
    },
    "overview": {
      "description": "Three to five sentences over the whole recording; final notes only. The user's words once overviewEditedAt is set.",
      "type": "string",
      "minLength": 1,
      "maxLength": 1200
    },
    "items": {
      "type": "array",
      "items": {
        "$ref": "#/$defs/item"
      }
    },
    "tombstones": {
      "description": "Items the user deleted; an item that matches one is never shown again.",
      "type": "array",
      "items": {
        "type": "object",
        "additionalProperties": false,
        "required": [
          "kind",
          "text",
          "atSec",
          "deletedAt"
        ],
        "properties": {
          "kind": {
            "$ref": "#/$defs/kind"
          },
          "text": {
            "type": "string",
            "minLength": 1
          },
          "atSec": {
            "type": "number",
            "minimum": 0
          },
          "deletedAt": {
            "type": "string",
            "format": "date-time"
          },
          "section": {
            "description": "The id of the user's section a deleted section item was in.",
            "$ref": "#/$defs/ulid"
          }
        }
      }
    },
    "conversations": {
      "description": "The final pass's conversations in order, each with its summary when it had enough words to be asked about.",
      "type": "array",
      "items": {
        "type": "object",
        "additionalProperties": false,
        "required": [
          "startSec",
          "endSec"
        ],
        "properties": {
          "startSec": {
            "type": "number",
            "minimum": 0
          },
          "endSec": {
            "type": "number",
            "minimum": 0
          },
          "summary": {
            "type": "string",
            "minLength": 1,
            "maxLength": 1200
          }
        }
      }
    },
    "parts": {
      "description": "The part numbers the provisional pass is done with, notes or not.",
      "type": "array",
      "uniqueItems": true,
      "items": {
        "type": "integer",
        "minimum": 1
      }
    },
    "model": {
      "description": "The ChatGPT model the notes were last made with.",
      "type": "string",
      "minLength": 1
    },
    "modelName": {
      "description": "The plan's name for model (`GPT-5.4`), shown under the notes.",
      "type": "string",
      "minLength": 1
    },
    "sections": {
      "description": "The sections the notes were made with (Settings → Notes → Sections), in order: the built-in groups the user kept — each its kind, with the name and description the user gave it, empty for the group's own — then up to three of the user's own, plus an earlier section still holding an item the user edited, so the list itself is not capped. A built-in group's name heads its items; empty, the app's word for it does.",
      "type": "array",
      "items": {
        "type": "object",
        "additionalProperties": false,
        "required": [
          "id",
          "name",
          "kind"
        ],
        "properties": {
          "id": {
            "description": "A section of the user's own: its ULID. A built-in group: its kind.",
            "type": "string"
          },
          "name": {
            "type": "string",
            "maxLength": 40
          },
          "description": {
            "description": "What goes in it, as the user wrote it; may be empty.",
            "type": "string",
            "maxLength": 200
          },
          "kind": {
            "description": "section: one of the user's own; any other: that built-in group.",
            "$ref": "#/$defs/kind"
          }
        },
        "if": {
          "properties": {
            "kind": {
              "const": "section"
            }
          }
        },
        "then": {
          "properties": {
            "id": {
              "$ref": "#/$defs/ulid"
            },
            "name": {
              "type": "string",
              "minLength": 1
            }
          }
        },
        "else": {
          "properties": {
            "id": {
              "type": "string",
              "enum": [
                "decision",
                "todo",
                "question",
                "point"
              ]
            }
          }
        }
      }
    },
    "overviewEditedAt": {
      "description": "When the user last changed the overview in Edit notes; from then on the overview stays theirs.",
      "type": "string",
      "format": "date-time"
    },
    "createdAt": {
      "type": "string",
      "format": "date-time"
    },
    "updatedAt": {
      "type": "string",
      "format": "date-time"
    },
    "finalizedAt": {
      "type": "string",
      "format": "date-time"
    }
  },
  "allOf": [
    {
      "if": {
        "type": "object",
        "properties": {
          "stage": {
            "const": "final"
          }
        }
      },
      "then": {
        "type": "object",
        "required": [
          "finalizedAt"
        ],
        "properties": {
          "finalizedAt": {
            "type": "string"
          }
        }
      },
      "else": {
        "type": "object",
        "properties": {
          "finalizedAt": false,
          "overview": false
        }
      }
    }
  ],
  "$defs": {
    "ulid": {
      "type": "string",
      "pattern": "^[0-7][0-9A-HJKMNP-TV-Z]{25}$"
    },
    "kind": {
      "description": "point: a key point, made after Stop only; section: an item of one of the user's own sections, named by the item's section.",
      "enum": [
        "decision",
        "todo",
        "question",
        "point",
        "section"
      ]
    },
    "item": {
      "type": "object",
      "additionalProperties": false,
      "required": [
        "id",
        "kind",
        "text",
        "evidence",
        "provisional",
        "createdAt"
      ],
      "properties": {
        "id": {
          "$ref": "#/$defs/ulid"
        },
        "kind": {
          "$ref": "#/$defs/kind"
        },
        "text": {
          "description": "What the model wrote, which matching goes by; the user's words are userText.",
          "type": "string",
          "minLength": 1,
          "maxLength": 500
        },
        "owner": {
          "description": "The speaker id of the transcript the item was made from, for a to-do: the recording's for a final item, the part's own for a provisional one. Never a name.",
          "type": "string",
          "pattern": "^S[0-9]{1,3}$"
        },
        "due": {
          "description": "The deadline as it was said.",
          "type": "string",
          "minLength": 1,
          "maxLength": 100
        },
        "evidence": {
          "type": "object",
          "additionalProperties": false,
          "required": [
            "atSec",
            "quote"
          ],
          "properties": {
            "atSec": {
              "type": "number",
              "minimum": 0
            },
            "quote": {
              "description": "Words of the transcript near atSec, verbatim (checked on the device).",
              "type": "string",
              "minLength": 1
            }
          }
        },
        "provisional": {
          "type": "boolean"
        },
        "conversation": {
          "description": "The index of a final item's conversation.",
          "type": "integer",
          "minimum": 0
        },
        "section": {
          "description": "The id of the user's section a section item is in.",
          "$ref": "#/$defs/ulid"
        },
        "userText": {
          "description": "The user's words for the item from Edit notes, shown instead of text.",
          "type": "string",
          "minLength": 1,
          "maxLength": 500
        },
        "editedAt": {
          "description": "When the user last edited the item; an edited item stays theirs.",
          "type": "string",
          "format": "date-time"
        },
        "createdAt": {
          "type": "string",
          "format": "date-time"
        }
      }
    }
  }
}
